{
  "$schema": "https://json-schema.org/draft/2020-12/schema",
  "$id": "https://phoenixgott.github.io/analyse-paris-buts/schema/match.schema.json",
  "title": "Match — Analyse Paris Buts",
  "description": "Contrat unique pour la collecte, le modèle, les graphiques et le prompt IA. Tout champ nullable vaut « N/D » quand il est null. Toutes les clés sont obligatoires : une donnée absente est écrite null, jamais omise.",
  "type": "object",
  "additionalProperties": false,
  "required": [
    "schema_version", "demo", "match_id", "generated_at", "competition", "coup_envoi", "stade", "enjeu",
    "equipes", "h2h", "arbitre", "meteo", "buteurs", "cotes", "qualite_donnees", "sources"
  ],
  "properties": {
    "schema_version": { "type": "string", "enum": ["1.1.0"], "description": "1.1.0 : ajout de stats.buts_par_tranche." },
    "demo": { "type": "boolean", "description": "true = données de démonstration fictives, toujours marquées DÉMO à l'écran." },
    "match_id": { "type": "string", "pattern": "^[a-z0-9-]+$" },
    "generated_at": { "type": "string", "pattern": "^\\d{4}-\\d{2}-\\d{2}T\\d{2}:\\d{2}:\\d{2}(\\.\\d+)?Z$" },
    "competition": {
      "type": "object",
      "additionalProperties": false,
      "required": ["id", "nom", "pays", "categorie", "palier"],
      "properties": {
        "id": { "type": ["string", "null"] },
        "nom": { "type": "string" },
        "pays": { "type": ["string", "null"] },
        "categorie": { "type": "string", "enum": ["H", "F", "INT"] },
        "palier": { "type": "integer", "enum": [1, 2] }
      }
    },
    "coup_envoi": { "type": "string", "pattern": "^\\d{4}-\\d{2}-\\d{2}T\\d{2}:\\d{2}:\\d{2}Z$", "description": "Heure UTC ; affichée en Europe/Paris." },
    "stade": {
      "type": ["object", "null"],
      "additionalProperties": false,
      "required": ["nom", "ville"],
      "properties": {
        "nom": { "type": ["string", "null"] },
        "ville": { "type": ["string", "null"] }
      }
    },
    "enjeu": { "type": ["string", "null"] },
    "equipes": {
      "type": "object",
      "additionalProperties": false,
      "required": ["domicile", "exterieur"],
      "properties": {
        "domicile": { "$ref": "#/$defs/equipe" },
        "exterieur": { "$ref": "#/$defs/equipe" }
      }
    },
    "h2h": {
      "type": ["array", "null"],
      "maxItems": 10,
      "description": "Confrontations directes, la plus récente d'abord. Score du point de vue domicile - extérieur du match analysé.",
      "items": {
        "type": "object",
        "additionalProperties": false,
        "required": ["date", "score", "score_mt"],
        "properties": {
          "date": { "$ref": "#/$defs/date_ou_null" },
          "score": { "$ref": "#/$defs/score_ou_null" },
          "score_mt": { "$ref": "#/$defs/score_ou_null" }
        }
      }
    },
    "arbitre": {
      "type": ["object", "null"],
      "additionalProperties": false,
      "required": ["nom", "cartons_moy", "penaltys_moy"],
      "properties": {
        "nom": { "type": ["string", "null"] },
        "cartons_moy": { "$ref": "#/$defs/positif_ou_null" },
        "penaltys_moy": { "$ref": "#/$defs/positif_ou_null" }
      }
    },
    "meteo": {
      "type": ["object", "null"],
      "additionalProperties": false,
      "required": ["temperature", "vent", "pluie"],
      "properties": {
        "temperature": { "type": ["number", "null"], "description": "°C" },
        "vent": { "$ref": "#/$defs/positif_ou_null", "description": "km/h" },
        "pluie": { "$ref": "#/$defs/positif_ou_null", "description": "mm/h" }
      }
    },
    "buteurs": {
      "type": ["array", "null"],
      "items": {
        "type": "object",
        "additionalProperties": false,
        "required": ["nom", "equipe", "buts_par_90", "tirs_par_90", "tireur_penalty", "coups_de_pied_arretes", "minutes_prevues"],
        "properties": {
          "nom": { "type": "string" },
          "equipe": { "type": "string", "enum": ["D", "E"] },
          "buts_par_90": { "$ref": "#/$defs/positif_ou_null" },
          "tirs_par_90": { "$ref": "#/$defs/positif_ou_null" },
          "tireur_penalty": { "type": ["boolean", "null"] },
          "coups_de_pied_arretes": { "type": ["boolean", "null"] },
          "minutes_prevues": { "type": ["integer", "null"], "minimum": 0, "maximum": 120 }
        }
      }
    },
    "cotes": {
      "type": ["object", "null"],
      "additionalProperties": false,
      "required": ["total_buts", "mt_over_0_5", "mt_over_1_5", "buteur"],
      "properties": {
        "total_buts": {
          "type": ["object", "null"],
          "additionalProperties": false,
          "required": [
            "over_0_5", "over_1_5", "over_2_5", "over_3_5", "over_4_5", "over_5_5",
            "under_0_5", "under_1_5", "under_2_5", "under_3_5", "under_4_5", "under_5_5"
          ],
          "properties": {
            "over_0_5": { "$ref": "#/$defs/cote" },
            "over_1_5": { "$ref": "#/$defs/cote" },
            "over_2_5": { "$ref": "#/$defs/cote" },
            "over_3_5": { "$ref": "#/$defs/cote" },
            "over_4_5": { "$ref": "#/$defs/cote" },
            "over_5_5": { "$ref": "#/$defs/cote" },
            "under_0_5": { "$ref": "#/$defs/cote" },
            "under_1_5": { "$ref": "#/$defs/cote" },
            "under_2_5": { "$ref": "#/$defs/cote" },
            "under_3_5": { "$ref": "#/$defs/cote" },
            "under_4_5": { "$ref": "#/$defs/cote" },
            "under_5_5": { "$ref": "#/$defs/cote" }
          }
        },
        "mt_over_0_5": { "$ref": "#/$defs/cote" },
        "mt_over_1_5": { "$ref": "#/$defs/cote" },
        "buteur": {
          "type": ["array", "null"],
          "items": {
            "type": "object",
            "additionalProperties": false,
            "required": ["nom", "equipe", "cote"],
            "properties": {
              "nom": { "type": "string" },
              "equipe": { "type": ["string", "null"], "enum": ["D", "E", null] },
              "cote": { "$ref": "#/$defs/cote" }
            }
          }
        }
      }
    },
    "qualite_donnees": { "type": "integer", "minimum": 0, "maximum": 100 },
    "sources": {
      "type": "array",
      "items": {
        "type": "object",
        "additionalProperties": false,
        "required": ["nom", "recupere_le"],
        "properties": {
          "nom": { "type": "string" },
          "recupere_le": { "type": ["string", "null"] }
        }
      }
    }
  },
  "$defs": {
    "positif_ou_null": { "type": ["number", "null"], "minimum": 0 },
    "pct_ou_null": { "type": ["number", "null"], "minimum": 0, "maximum": 100 },
    "date_ou_null": { "type": ["string", "null"], "pattern": "^\\d{4}-\\d{2}-\\d{2}$" },
    "score_ou_null": { "type": ["string", "null"], "pattern": "^\\d{1,2}-\\d{1,2}$" },
    "six_tranches": {
      "type": ["array", "null"],
      "minItems": 6,
      "maxItems": 6,
      "items": { "type": ["integer", "null"], "minimum": 0 }
    },
    "cote": {
      "type": ["object", "null"],
      "additionalProperties": false,
      "required": ["meilleure", "bookmaker", "ouverture", "mouvement"],
      "properties": {
        "meilleure": { "type": ["number", "null"], "minimum": 1 },
        "bookmaker": { "type": ["string", "null"] },
        "ouverture": { "type": ["number", "null"], "minimum": 1 },
        "mouvement": { "type": ["number", "null"], "description": "meilleure − ouverture (écart de cote, signé)" }
      }
    },
    "equipe": {
      "type": "object",
      "additionalProperties": false,
      "required": ["id", "nom", "elo", "classement", "forme", "stats", "jours_repos", "absents", "compo_probable"],
      "properties": {
        "id": { "type": ["string", "null"] },
        "nom": { "type": "string" },
        "elo": { "type": ["number", "null"] },
        "classement": {
          "type": ["object", "null"],
          "additionalProperties": false,
          "required": ["rang", "points", "joues", "bp", "bc"],
          "properties": {
            "rang": { "type": ["integer", "null"], "minimum": 1 },
            "points": { "type": ["integer", "null"] },
            "joues": { "type": ["integer", "null"], "minimum": 0 },
            "bp": { "type": ["integer", "null"], "minimum": 0 },
            "bc": { "type": ["integer", "null"], "minimum": 0 }
          }
        },
        "forme": {
          "type": ["array", "null"],
          "maxItems": 10,
          "description": "10 derniers matchs, le plus récent d'abord. Score du point de vue de l'équipe (buts pour - buts contre).",
          "items": {
            "type": "object",
            "additionalProperties": false,
            "required": ["date", "adversaire", "lieu", "score", "score_mt"],
            "properties": {
              "date": { "$ref": "#/$defs/date_ou_null" },
              "adversaire": { "type": ["string", "null"] },
              "lieu": { "type": ["string", "null"], "enum": ["D", "E", null] },
              "score": { "$ref": "#/$defs/score_ou_null" },
              "score_mt": { "$ref": "#/$defs/score_ou_null" }
            }
          }
        },
        "stats": {
          "type": ["object", "null"],
          "additionalProperties": false,
          "required": [
            "buts_marques_moy", "buts_encaisses_moy", "buts_mt_marques_moy", "buts_mt_encaisses_moy",
            "xg_moy", "tirs_cadres_moy", "pct_over15", "pct_over25", "pct_over35", "pct_but_avant_30", "buts_par_tranche"
          ],
          "properties": {
            "buts_marques_moy": { "$ref": "#/$defs/positif_ou_null" },
            "buts_encaisses_moy": { "$ref": "#/$defs/positif_ou_null" },
            "buts_mt_marques_moy": { "$ref": "#/$defs/positif_ou_null" },
            "buts_mt_encaisses_moy": { "$ref": "#/$defs/positif_ou_null" },
            "xg_moy": { "$ref": "#/$defs/positif_ou_null" },
            "tirs_cadres_moy": { "$ref": "#/$defs/positif_ou_null" },
            "pct_over15": { "$ref": "#/$defs/pct_ou_null" },
            "pct_over25": { "$ref": "#/$defs/pct_ou_null" },
            "pct_over35": { "$ref": "#/$defs/pct_ou_null" },
            "pct_but_avant_30": { "$ref": "#/$defs/pct_ou_null" },
            "buts_par_tranche": {
              "type": ["object", "null"],
              "description": "Buts de la saison par tranche de 15 minutes : 0-15, 16-30, 31-45, 46-60, 61-75, 76-90 (temps additionnel inclus dans la tranche qui précède).",
              "additionalProperties": false,
              "required": ["matchs", "marques", "encaisses"],
              "properties": {
                "matchs": { "type": ["integer", "null"], "minimum": 1 },
                "marques": { "$ref": "#/$defs/six_tranches" },
                "encaisses": { "$ref": "#/$defs/six_tranches" }
              }
            }
          }
        },
        "jours_repos": { "type": ["integer", "null"], "minimum": 0 },
        "absents": {
          "type": ["array", "null"],
          "description": "null = inconnu ; [] = aucun absent signalé par la source.",
          "items": {
            "type": "object",
            "additionalProperties": false,
            "required": ["nom", "raison"],
            "properties": {
              "nom": { "type": "string" },
              "raison": { "type": ["string", "null"] }
            }
          }
        },
        "compo_probable": { "type": ["array", "null"], "items": { "type": "string" } }
      }
    }
  }
}
